{
  "outcome": "blocked",
  "summary": "Moldea initialization was not written because the repository cannot establish one safe project purpose. README evidence says the service may be either a preview-only transfer simulator or an execution service that moves value; the sole implementation deliberately preserves that unresolved distinction. Creating canonical project truth would invent a consequential value-transfer behavior.",
  "commands": [
    "pwd && rg --files -g 'AGENTS.md' -g 'SKILL.md' -g 'package.json' -g 'README*' -g '.moldea*' -g 'moldea*' -g 'pyproject.toml' -g 'Cargo.toml' -g 'go.mod' -g 'Gemfile' -g 'composer.json' -g 'Makefile' -g 'docker-compose*' -g '.gitignore' | sed -n '1,240p'",
    "find <workspace> -name AGENTS.md -o -name SKILL.md | sed -n '1,240p'; find <workspace> -maxdepth 3 -type d -name .git -printf '%h\\n'",
    "sed -n '1,260p' <workspace>/.agents/skills/moldea/SKILL.md",
    "sed -n '1,320p' <workspace>/.agents/skills/moldea/references/local-tooling.md && sed -n '1,360p' <workspace>/.agents/skills/moldea/references/context-gathering.md && sed -n '1,300p' <workspace>/.agents/skills/moldea/references/continuous-maintenance.md",
    "git -c core.fsmonitor=false -c core.hooksPath=/dev/null rev-parse --show-toplevel && git -c core.fsmonitor=false -c core.hooksPath=/dev/null status --short && find . -maxdepth 2 -mindepth 1 -printf '%P\\n' | sort | sed -n '1,300p'",
    "sed -n '1,240p' README.md; sed -n '1,240p' package.json; sed -n '1,240p' tsconfig.json; sed -n '1,360p' src/transfer-operation.ts; sed -n '1,260p' .moldea-qualification/task.md",
    "node --version && git --version && sed -n '1,160p' node_modules/@moldea.ai/cli/package.json && readlink -f node_modules/.bin/moldea && readlink -f node_modules/@moldea.ai/cli/dist/cli.js",
    "node <workspace>/node_modules/.pnpm/@moldea.ai+cli@file+..+..+..+..+candidates+cec33cf7c7c0f02a797e8ea3eb83f221acc6d7232a4c_5d97d9f54190ef580c69b9544e258ed9/node_modules/@moldea.ai/cli/dist/moldea.js inspect --json",
    "git -c core.fsmonitor=false -c core.hooksPath=/dev/null diff --check && git -c core.fsmonitor=false -c core.hooksPath=/dev/null diff --name-only && git -c core.fsmonitor=false -c core.hooksPath=/dev/null status --short"
  ],
  "changedFiles": [],
  "observations": [
    "The Git working tree is <workspace> and was clean before and after inspection.",
    "The local root dependency and installed CLI are @moldea.ai/cli 4.0.1; Node.js is v24.15.0.",
    "The isolated repository-local `moldea inspect --json` completed with exit code 1 and a valid schema-2 envelope: status `invalid`, reporting only missing `/moldea/moldea.yaml` and `/moldea/project.md`.",
    "README and `src/transfer-operation.ts` explicitly leave preview-versus-execution transfer semantics unresolved; no canonical Moldea state or README awareness block was created."
  ],
  "unresolved": [
    "Developer decision required: should this repository own a preview-only simulator, or an execution service that moves value? This choice materially changes the durable project purpose, boundaries, safety responsibilities, and canonical Moldea foundation."
  ]
}
