{
  "outcome": "completed",
  "summary": "No edits were needed. `support` and `summary` are aligned with their direct Vercel AI SDK generation wrappers: canonical instructions are loaded and awaited at invocation, declared output schemas are supplied through `Output.object`, and support’s declared `find-order` function tool matches its registration, schemas, and implementation. No provider, model, routing, handoff, subagent, or agent-input-schema relationship was inferred or assessed.",
  "commands": [
    "node_modules/.bin/moldea inspect --json",
    "node_modules/.bin/moldea validate --json",
    "node_modules/.bin/tsc --noEmit",
    "git -c core.fsmonitor=false -c core.pager=cat -c diff.external= -c core.autocrlf=false status --short && git -c core.fsmonitor=false -c core.pager=cat -c diff.external= -c core.autocrlf=false diff --check && git -c core.fsmonitor=false -c core.pager=cat -c diff.external= -c core.autocrlf=false diff --no-ext-diff --exit-code && git -c core.fsmonitor=false -c core.pager=cat -c diff.external= -c core.autocrlf=false diff --cached --no-ext-diff --exit-code"
  ],
  "changedFiles": [],
  "observations": [
    "Repository-local Moldea CLI was verified as exact version 4.0.1.",
    "`inspect --json` returned schemaVersion 2, status `valid`, and no diagnostics; adapter evidence detected both instruction loaders, both output schemas, support `generateText`, summary `streamText`, and support’s function-tool registration.",
    "`validate --json` returned schemaVersion 2, status `valid`, and no diagnostics.",
    "TypeScript validation passed.",
    "Final Git status and staged/unstaged diffs are empty."
  ],
  "unresolved": []
}
